id,date,speaker,statement,sources,paragraph_based_content,fullText_based_content,www.glennbeck.com
10876,2015-05-28T11:31:01-04:00,Glenn Beck,"Says Hillary Clinton ""makes more per hour at a speaking gig than the average CEO does in a year.""","['http://www.glennbeck.com/content/show/2015-05-13/', 'http://www.washingtonexaminer.com/by-one-measure-hillary-earned-more-than-americas-top-10-ceos/article/2563275', 'https://www.scribd.com/doc/265546982/Hillary-Clinton-PFD#download', 'http://www.epi.org/publication/ceo-pay-continues-to-rise/', 'http://www.aflcio.org/Corporate-Watch/Paywatch-2015']","['Conservative pundits are calling out Democratic presidential candidate Hillary Clinton for reeling in hefty speaking fees when she left the State Department, saying the big checks belie her message of addressing income inequality as she runs for the White House.', '""Let’s remember one thing about this woman of the people,"" conservative radio host Glenn Beck said on his May 13 show. ""She knows a few things about making money. She makes more per hour at a speaking gig than the average CEO does in a year. Let me say that again: She makes more at a speaking gig in an hour than the average CEO does in a year. But let’s have her lecture us about those out of control CEO salaries.""', 'A reader wanted to know if that was true.', 'The Clinton presidential campaign did not comment for this fact-check. A spokesperson for Beck could also not be reached.', 'Clinton’s pay', 'Since leaving her post as secretary of state in 2013, Clinton has earned millions of dollars from giving talks at universities, corporations and industry groups. So has her husband.', 'The Clinton Foundation recently disclosed speaking engagements by Bill, Hillary and Chelsea Clinton that brought in between $12 million and $26 million for the foundation. The foundation counts 16 Hillary Clinton speeches without giving specific amounts, including nine in the range of $250,001-$500,000 and seven within $100,001-$250,000.', 'Those fees go to the foundation. What about fees that go to the Clintons themselves?', 'Hillary Clinton’s 2015 financial disclosure provides more specific information about 51 additional speeches in 2014 and 2015. The honorariums varied in amount, so here are some examples:', 'On the lower end of the scale, Salesforce.com paid $125,000, the California Medical Association paid $100,000, and the Canadian Imperial Bank of Commerce paid $150,000. On the high end, Biotechnology Industry Organization and Qualcomm paid $335,000, eBay paid $315,000, and Cisco paid $325,000.', 'More typical were honorariums around $225,000, such as from speeches to a Silicon Valley conference for women, Commercial Real Estate Women Network, SalesForce.com, the Council of Insurance Agents and Brokers, Ameriprise and the National Council for Behavioral Healthcare, among others.', 'With that background in mind, let’s compare her speaking fees to the average pay of CEOs.', 'CEO pay', 'There are a few ways of talking about CEO pay, and it comes down to how you define the average CEO. Workers with that job description can make anywhere from five to nine figures.', 'Beck might be referencing a widely shared Washington Examiner story that compared Clinton’s ""reported premium speaking fee of $300,000 per speech"" to the earnings of the country’s top 10 highest-paid CEOs (as reported by Forbes ). The Examiner broke down the CEOs’ total compensation by a federal standard of 2,080 yearly work-hours.', 'The result: If you broke down CEO pay by the hour, they would earn $54,213 compared to Clinton’s $300,000 speaking fee (which is on the high side of what we found).', 'The Examiner also points out that, realistically speaking, it takes more than an hour to make a speech happen — there’s also speech prep, travel, and time for meals and rest to consider, too.', 'However, Beck’s statement did not include the hourly nuance at all. He simply compared one Clinton speech to the annual income of a CEO.', 'By one measure from the liberal Economic Policy Institute, Beck is way, way off.', 'The think tank found that CEOs of the country’s top 350 firms received average compensation of $15.2 million in 2013, the latest year for which data is available. The EPI researchers used data from Compustat, which pulls in chief executive salaries from publicly held companies as reported to the U.S. Securities and Exchange Commission.', 'That’s several zeroes away from Clinton’s average $225,000 speech in 2014 and 2015.', 'The AFL-CIO compiled a list of the 100 highest-paid CEOs in 2014. No. 100 was Dr. Leonard Bell of Alexion Pharmaceuticals, who earned $20 million.', 'Naturally, the income of the average CEO decreases as you expand the definition of who is a CEO.', 'Economist Mark Perry of the conservative American Enterprise Institute critiques the EPI methodology for neglecting CEO salaries on the lower end of the spectrum.', 'The Bureau of Labor Statistics identifies 246,240 people by the title of ""chief executive."" Looking at that group, as of May 2014, the average wages was $180,700. For the more than 21,000 employees within that group who work as managers of companies and enterprises , average annual pay was about $216,100.', 'While those figures are less than the typical Clinton speaking fee, they’re an incomplete picture of what people who classify themselves as chief executives make.', 'For one, as our colleagues FactCheck.org pointed out, the BLS data does not factor in stock options, bonuses and other benefits that typically round out a CEO’s total compensation.', 'Several reports back up that salary comprises at least less than half of total compensation for many CEOs.', ""For instance, salary made up just 10 percent of a CEO's total compensation in 2012, according to an Associated Press analysis of about 320 companies. A survey of 50 big-company CEOs for the Wall Street Journal found cash pay made up about 37 percent of a CEO's total compensation in 2014. Expanding the pool, Equilar determined that of the S&P 1500 CEOs, 20.8 percent of the pay mix in 2014 was for salary."", 'Also, the BLS averages include chief executives in Puerto Rico, as well as those who work in the public sector at schools and in government that might not fit the classic CEO definition. (Those groups, by the way, all see below-average wages, according to BLS.)', 'Plus, counting every CEO’s pay overlooks that the vast majority employ few workers, said Lawrence Mishel, Economic Policy Institute president and an economist who worked on the executive pay research.', '""That’s cute but highly misleading,"" Mishel said of Perry’s criticism, ""because it doesn’t reflect that the average worker works for a large firm, and the average CEO works for a very small firm.""', 'The CEOs of small- to mid-sized businesses also often own large chunks of their businesses that can be sold as capital gains or passed down to heirs, which would not be counted as compensation, said Kevin Murphy, University of Southern California finance professor.', 'The debate about who counts as a typical CEO could also be applied to the worlds of professional athletes, musicians and actors.', '""The fact is that, in many occupations with ‘superstars,’ the distribution of pay is highly skewed in the sense that the pay for the top earners may be many multiples of the pay for the median person in that occupation,"" Murphy said. ""Perhaps it’s best for us to always qualify ‘CEO’ with ‘Superstar CEO’ or ‘S&P 500 CEO’ to avoid confusion.""']","Conservative pundits are calling out Democratic presidential candidate Hillary Clinton for reeling in hefty speaking fees when she left the State Department, saying the big checks belie her message of addressing income inequality as she runs for the White House.
""Let’s remember one thing about this woman of the people,"" conservative radio host Glenn Beck said on his May 13 show. ""She knows a few things about making money. She makes more per hour at a speaking gig than the average CEO does in a year. Let me say that again: She makes more at a speaking gig in an hour than the average CEO does in a year. But let’s have her lecture us about those out of control CEO salaries.""
A reader wanted to know if that was true.
The Clinton presidential campaign did not comment for this fact-check. A spokesperson for Beck could also not be reached.
Clinton’s pay
Since leaving her post as secretary of state in 2013, Clinton has earned millions of dollars from giving talks at universities, corporations and industry groups. So has her husband.
The Clinton Foundation recently disclosed speaking engagements by Bill, Hillary and Chelsea Clinton that brought in between $12 million and $26 million for the foundation. The foundation counts 16 Hillary Clinton speeches without giving specific amounts, including nine in the range of $250,001-$500,000 and seven within $100,001-$250,000.
Those fees go to the foundation. What about fees that go to the Clintons themselves?
Hillary Clinton’s 2015 financial disclosure provides more specific information about 51 additional speeches in 2014 and 2015. The honorariums varied in amount, so here are some examples:
On the lower end of the scale, Salesforce.com paid $125,000, the California Medical Association paid $100,000, and the Canadian Imperial Bank of Commerce paid $150,000. On the high end, Biotechnology Industry Organization and Qualcomm paid $335,000, eBay paid $315,000, and Cisco paid $325,000.
More typical were honorariums around $225,000, such as from speeches to a Silicon Valley conference for women, Commercial Real Estate Women Network, SalesForce.com, the Council of Insurance Agents and Brokers, Ameriprise and the National Council for Behavioral Healthcare, among others.
With that background in mind, let’s compare her speaking fees to the average pay of CEOs.
CEO pay
There are a few ways of talking about CEO pay, and it comes down to how you define the average CEO. Workers with that job description can make anywhere from five to nine figures.
Beck might be referencing a widely shared Washington Examiner story that compared Clinton’s ""reported premium speaking fee of $300,000 per speech"" to the earnings of the country’s top 10 highest-paid CEOs (as reported by Forbes ). The Examiner broke down the CEOs’ total compensation by a federal standard of 2,080 yearly work-hours.
The result: If you broke down CEO pay by the hour, they would earn $54,213 compared to Clinton’s $300,000 speaking fee (which is on the high side of what we found).
The Examiner also points out that, realistically speaking, it takes more than an hour to make a speech happen — there’s also speech prep, travel, and time for meals and rest to consider, too.
However, Beck’s statement did not include the hourly nuance at all. He simply compared one Clinton speech to the annual income of a CEO.
By one measure from the liberal Economic Policy Institute, Beck is way, way off.
The think tank found that CEOs of the country’s top 350 firms received average compensation of $15.2 million in 2013, the latest year for which data is available. The EPI researchers used data from Compustat, which pulls in chief executive salaries from publicly held companies as reported to the U.S. Securities and Exchange Commission.
That’s several zeroes away from Clinton’s average $225,000 speech in 2014 and 2015.
The AFL-CIO compiled a list of the 100 highest-paid CEOs in 2014. No. 100 was Dr. Leonard Bell of Alexion Pharmaceuticals, who earned $20 million.
Naturally, the income of the average CEO decreases as you expand the definition of who is a CEO.
Economist Mark Perry of the conservative American Enterprise Institute critiques the EPI methodology for neglecting CEO salaries on the lower end of the spectrum.
The Bureau of Labor Statistics identifies 246,240 people by the title of ""chief executive."" Looking at that group, as of May 2014, the average wages was $180,700. For the more than 21,000 employees within that group who work as managers of companies and enterprises , average annual pay was about $216,100.
While those figures are less than the typical Clinton speaking fee, they’re an incomplete picture of what people who classify themselves as chief executives make.
For one, as our colleagues FactCheck.org pointed out, the BLS data does not factor in stock options, bonuses and other benefits that typically round out a CEO’s total compensation.
Several reports back up that salary comprises at least less than half of total compensation for many CEOs.
For instance, salary made up just 10 percent of a CEO's total compensation in 2012, according to an Associated Press analysis of about 320 companies. A survey of 50 big-company CEOs for the Wall Street Journal found cash pay made up about 37 percent of a CEO's total compensation in 2014. Expanding the pool, Equilar determined that of the S&P 1500 CEOs, 20.8 percent of the pay mix in 2014 was for salary.
Also, the BLS averages include chief executives in Puerto Rico, as well as those who work in the public sector at schools and in government that might not fit the classic CEO definition. (Those groups, by the way, all see below-average wages, according to BLS.)
Plus, counting every CEO’s pay overlooks that the vast majority employ few workers, said Lawrence Mishel, Economic Policy Institute president and an economist who worked on the executive pay research.
""That’s cute but highly misleading,"" Mishel said of Perry’s criticism, ""because it doesn’t reflect that the average worker works for a large firm, and the average CEO works for a very small firm.""
The CEOs of small- to mid-sized businesses also often own large chunks of their businesses that can be sold as capital gains or passed down to heirs, which would not be counted as compensation, said Kevin Murphy, University of Southern California finance professor.
The debate about who counts as a typical CEO could also be applied to the worlds of professional athletes, musicians and actors.
""The fact is that, in many occupations with ‘superstars,’ the distribution of pay is highly skewed in the sense that the pay for the top earners may be many multiples of the pay for the median person in that occupation,"" Murphy said. ""Perhaps it’s best for us to always qualify ‘CEO’ with ‘Superstar CEO’ or ‘S&P 500 CEO’ to avoid confusion.""",fake
11368,2015-10-02T05:00:00-04:00,Scott Walker,"Israel has seen a ""90 percent reduction in terrorist attacks"" that it attributes to building a 500-mile fence.","['http://www.jewishvirtuallibrary.org/jsource/Peace/fence.html', 'http://www.mfa.gov.il/mfa/foreignpolicy/terrorism/palestinian/pages/suicide%20and%20other%20bombing%20attacks%20in%20israel%20since.aspx', 'http://mfa.gov.il/MFA/ForeignPolicy/FAQ/Pages/Israel-%20the%20Conflict%20and%20Peace-%20Answers%20to%20Frequen.aspx#lessterror', 'http://www.glennbeck.com/2015/08/17/scott-walker-unveils-plans-to-replace-obamacare', 'http://www.start.umd.edu/topics/terrorism-trends', 'http://www.fas.org/sgp/crs/mideast/RL33476.pdf', 'http://www.fas.org/sgp/crs/mideast/IN10183.pdf', 'https://www.fas.org/sgp/crs/mideast/RL34074.pdf', 'http://www.cfr.org/israel/crisis-guide-israeli-palestinian-conflict/p13850?gclid=Cj0KEQjw4ZOwBRDoxpjAvPXAl5MBEiQAEek_3tunyVeIPZ1qsMGTWf-Uzwz9r3gIRh4Vc-uKn5_HhywaArOL8P8HAQ']","['With Gov. Scott Walker out of the GOP presidential race, there’s likely to be little talk about the idea of a wall with Canada. But some of the remaining candidates are calling for a wall with Mexico aimed at securing that border from illegal immigrants.', 'And several of them have cited an example from Israel to bolster their stance -- including Walker, when he was a candidate. He pointed to one statistic we wanted to check.', 'During an Aug. 17, 2015 appearance on Glenn Beck’s radio show, Walker recalled his trip to the Middle East where he saw the barrier that had been constructed between Israel and the West Bank.', '""They’ve seen something like over a 90 percent reduction in terrorist acts in that country that they attribute to having an effective fence,"" Walker said. ""If Israel can do it effectively, there’s no reason why America can’t.""', 'That’s a significant decrease. Is it accurate?', 'A little background', 'Israelis and Palestinians have a long history of conflict over rights to land in the Middle East.', 'Our quick history will start in 1947, when the United Nations set out to create a Jewish and an Arab state, but only the Jewish state came into being.', 'The state of Israel was founded on May 14, 1948. Almost immediately, Arab armies invaded the new Jewish state.', 'The conflict ended with armistice agreements made between Israel and its neighboring Arab states, after hundreds of thousands of Palestinians fled the region. Those who stayed became Israeli citizens. The rest became refugees and remain stateless.', 'Periodic bouts of conflict between Israelis and Palestinians continued, with arguments centered on control of land and borders. Violence and terrorist attacks ebbed and flowed along with the political tensions in the region.', 'A major Palestinian uprising against Israel started in 2000 after failed peace talks and became known as the Second Intifada. The first Intifada took place in the late 1980s and early 90s.', 'In 2003, Israel began construction on a barrier to separate Israelis and Palestinians and prevent terrorists from entering Israel.', 'Behind the numbers', 'When asked for backup, Walker’s team sent a report compiled by the Jewish Virtual Library and last updated in April 2015. It says, ""since construction of the fence began, the number of attacks has declined by more than 90%.""', 'The Jewish Virtual Library is a project of the American-Israeli Cooperative Enterprise, a nonprofit group with the goal of strengthening U.S. relations with Israel. Mitchell Bard, author of the report and executive director of the American-Israeli Cooperative Enterprise, said the numbers for the report came from the Israeli Foreign Ministry.', 'Here’s how the numbers shake out:', 'The report used 2002, a year before construction began, as a baseline for comparison.', 'But 2002 was at the height of a streak of violence in the region, the Second Intifada, so that helps shade the picture from the beginning.', 'The data shows a wave of terrorist attacks in the region between 2001 and 2006. In 2001, there were 118 attacks, while in 2000 just 29 occurred, according to the Israeli Foreign Ministry.', '""The year itself is an anomaly,"" said James Gelvin, professor at University of California-Los Angeles and author of ""Israel Palestine Conflict: One Hundred Years of War.""', '""It was an extraordinarily bloody affair and that was when the wall was under construction,"" Gelvin said. ""Of course, after it ended attacks would go down anyway.""', 'There is another issue: The data is outdated, only going through 2012.', 'The following year, 2013, there were 11 incidents. Bard noted that when data from 2013 is added it still amounts to a 90 percent drop.', 'But in 2014 the number of attacks jumped to 62. By that measure, it is more like a 50 percent drop. So, the use of outdated numbers skews the end result.', 'In addition, the wall was not built in isolation.', 'Even Bard, the author of the Jewish Virtual Library analysis, said ""the main thing"" contributing to the decrease was not the wall itself, but the activity of Israeli security forces along the barrier.', 'He said the dramatic decrease in attacks was ""in part because of the fence,"" but also cited checkpoints and cooperation between military and security forces as important factors.', 'In short, attributing this short-term downward trend in attacks to the barrier is taking a very narrow approach to a more complicated issue.', 'Finally, the way Walker constructed the statement gives it an extra twist. He noted Israeli leaders attribute the drop in terrorist attacks to the wall. By implication, he seems to agree with them.', 'We found many references to the success of the ""anti-terrorist fence"" on Israel’s Ministry of Foreign Affairs website. Most notably on a Frequently Asked Questions page about the conflict, the ministry says, ""data reveals a clear correlation between the construction of the fence and a drop in the number of terrorist attacks.""']","With Gov. Scott Walker out of the GOP presidential race, there’s likely to be little talk about the idea of a wall with Canada. But some of the remaining candidates are calling for a wall with Mexico aimed at securing that border from illegal immigrants.
And several of them have cited an example from Israel to bolster their stance -- including Walker, when he was a candidate. He pointed to one statistic we wanted to check.
During an Aug. 17, 2015 appearance on Glenn Beck’s radio show, Walker recalled his trip to the Middle East where he saw the barrier that had been constructed between Israel and the West Bank.
""They’ve seen something like over a 90 percent reduction in terrorist acts in that country that they attribute to having an effective fence,"" Walker said. ""If Israel can do it effectively, there’s no reason why America can’t.""
That’s a significant decrease. Is it accurate?
A little background
Israelis and Palestinians have a long history of conflict over rights to land in the Middle East.
Our quick history will start in 1947, when the United Nations set out to create a Jewish and an Arab state, but only the Jewish state came into being.
The state of Israel was founded on May 14, 1948. Almost immediately, Arab armies invaded the new Jewish state.
The conflict ended with armistice agreements made between Israel and its neighboring Arab states, after hundreds of thousands of Palestinians fled the region. Those who stayed became Israeli citizens. The rest became refugees and remain stateless.
Periodic bouts of conflict between Israelis and Palestinians continued, with arguments centered on control of land and borders. Violence and terrorist attacks ebbed and flowed along with the political tensions in the region.
A major Palestinian uprising against Israel started in 2000 after failed peace talks and became known as the Second Intifada. The first Intifada took place in the late 1980s and early 90s.
In 2003, Israel began construction on a barrier to separate Israelis and Palestinians and prevent terrorists from entering Israel.
Behind the numbers
When asked for backup, Walker’s team sent a report compiled by the Jewish Virtual Library and last updated in April 2015. It says, ""since construction of the fence began, the number of attacks has declined by more than 90%.""
The Jewish Virtual Library is a project of the American-Israeli Cooperative Enterprise, a nonprofit group with the goal of strengthening U.S. relations with Israel. Mitchell Bard, author of the report and executive director of the American-Israeli Cooperative Enterprise, said the numbers for the report came from the Israeli Foreign Ministry.
Here’s how the numbers shake out:
The report used 2002, a year before construction began, as a baseline for comparison.
But 2002 was at the height of a streak of violence in the region, the Second Intifada, so that helps shade the picture from the beginning.
The data shows a wave of terrorist attacks in the region between 2001 and 2006. In 2001, there were 118 attacks, while in 2000 just 29 occurred, according to the Israeli Foreign Ministry.
""The year itself is an anomaly,"" said James Gelvin, professor at University of California-Los Angeles and author of ""Israel Palestine Conflict: One Hundred Years of War.""
""It was an extraordinarily bloody affair and that was when the wall was under construction,"" Gelvin said. ""Of course, after it ended attacks would go down anyway.""
There is another issue: The data is outdated, only going through 2012.
The following year, 2013, there were 11 incidents. Bard noted that when data from 2013 is added it still amounts to a 90 percent drop.
But in 2014 the number of attacks jumped to 62. By that measure, it is more like a 50 percent drop. So, the use of outdated numbers skews the end result.
In addition, the wall was not built in isolation.
Even Bard, the author of the Jewish Virtual Library analysis, said ""the main thing"" contributing to the decrease was not the wall itself, but the activity of Israeli security forces along the barrier.
He said the dramatic decrease in attacks was ""in part because of the fence,"" but also cited checkpoints and cooperation between military and security forces as important factors.
In short, attributing this short-term downward trend in attacks to the barrier is taking a very narrow approach to a more complicated issue.
Finally, the way Walker constructed the statement gives it an extra twist. He noted Israeli leaders attribute the drop in terrorist attacks to the wall. By implication, he seems to agree with them.
We found many references to the success of the ""anti-terrorist fence"" on Israel’s Ministry of Foreign Affairs website. Most notably on a Frequently Asked Questions page about the conflict, the ministry says, ""data reveals a clear correlation between the construction of the fence and a drop in the number of terrorist attacks.""",real
